{
  "$schema": "https://json-schema.org/draft/2020-12/schema",
  "$id": "bo.telemetry.v1",
  "title": "BO telemetry envelope v1",
  "description": "Contract comun CONTRACTE-V1: envelope + data per kind. Validarea runtime din openexecutive.bo.telemetry.schema oglindește acest document; testele de fixture țin cele două în pas.",
  "type": "object",
  "additionalProperties": false,
  "required": [
    "schemaVersion", "eventId", "producerId", "installationId", "tenantRef",
    "product", "kind", "occurredAt", "correlationId", "data"
  ],
  "properties": {
    "schemaVersion": {"const": "bo.telemetry.v1"},
    "eventId": {"$ref": "#/$defs/opaqueId"},
    "producerId": {"$ref": "#/$defs/opaqueId"},
    "installationId": {"$ref": "#/$defs/opaqueId"},
    "tenantRef": {"$ref": "#/$defs/opaqueId"},
    "product": {"enum": ["BOAgents", "Hire"]},
    "kind": {
      "enum": ["Heartbeat", "RunStarted", "RunFinished",
               "VerificationFinding", "ConfigApplied"]
    },
    "occurredAt": {"$ref": "#/$defs/rfc3339"},
    "correlationId": {"$ref": "#/$defs/opaqueId"},
    "agentRef": {"anyOf": [{"$ref": "#/$defs/opaqueId"}, {"type": "null"}]},
    "runRef": {"anyOf": [{"$ref": "#/$defs/opaqueId"}, {"type": "null"}]},
    "configVersion": {"type": "integer", "minimum": 0},
    "data": {"type": "object"}
  },
  "$defs": {
    "opaqueId": {
      "type": "string",
      "pattern": "^[A-Za-z0-9][A-Za-z0-9._:-]{0,127}$"
    },
    "rfc3339": {
      "type": "string",
      "pattern": "^\\d{4}-\\d{2}-\\d{2}T\\d{2}:\\d{2}:\\d{2}(\\.\\d+)?(Z|[+-]\\d{2}:\\d{2})$"
    },
    "heartbeatData": {
      "type": "object", "additionalProperties": false,
      "required": ["sequence", "status", "observedAt"],
      "properties": {
        "sequence": {"type": "integer", "minimum": 0},
        "status": {"enum": ["HEALTHY", "DEGRADED", "UNAVAILABLE"]},
        "observedAt": {"$ref": "#/$defs/rfc3339"}
      }
    },
    "runStartedData": {
      "type": "object", "additionalProperties": false,
      "required": ["runRef"],
      "properties": {
        "runRef": {"$ref": "#/$defs/opaqueId"},
        "definitionRef": {"$ref": "#/$defs/opaqueId"},
        "versionNo": {"type": "integer", "minimum": 1},
        "runKind": {"type": "string", "maxLength": 64}
      }
    },
    "runFinishedData": {
      "type": "object", "additionalProperties": false,
      "required": ["runRef", "executionStatus", "verificationStatus"],
      "properties": {
        "runRef": {"$ref": "#/$defs/opaqueId"},
        "executionStatus": {
          "enum": ["SUCCEEDED", "PARTIAL", "FAILED", "CANCELLED", "UNKNOWN"]
        },
        "verificationStatus": {
          "enum": ["VERIFIED", "PENDING", "MISMATCH", "UNKNOWN"]
        },
        "planHash": {"type": "string", "pattern": "^[0-9a-f]{64}$"},
        "durationMs": {"type": "number", "minimum": 0}
      }
    },
    "verificationFindingData": {
      "type": "object", "additionalProperties": false,
      "required": ["findingId", "category", "severity", "effectStatus"],
      "properties": {
        "findingId": {"$ref": "#/$defs/opaqueId"},
        "category": {"type": "string", "maxLength": 64},
        "severity": {"type": "string", "maxLength": 32},
        "effectStatus": {
          "enum": ["NOT_EXECUTED", "EXECUTED", "PARTIAL", "UNKNOWN"]
        },
        "ownerRef": {"type": "string", "maxLength": 256},
        "evidenceRefs": {
          "type": "array", "maxItems": 50,
          "items": {"type": "string", "maxLength": 256}
        }
      }
    },
    "configAppliedData": {
      "type": "object", "additionalProperties": false,
      "required": ["key", "configVersion", "applyMode"],
      "properties": {
        "key": {"type": "string", "maxLength": 128},
        "configVersion": {"type": "integer", "minimum": 0},
        "applyMode": {
          "enum": ["IMMEDIATE", "NEW_RUN", "RESTART", "MIGRATION"]
        },
        "actorRef": {"type": "string", "maxLength": 256}
      }
    }
  },
  "allOf": [
    {
      "if": {"properties": {"kind": {"const": "Heartbeat"}}},
      "then": {"properties": {"data": {"$ref": "#/$defs/heartbeatData"}}}
    },
    {
      "if": {"properties": {"kind": {"const": "RunStarted"}}},
      "then": {"properties": {"data": {"$ref": "#/$defs/runStartedData"}}}
    },
    {
      "if": {"properties": {"kind": {"const": "RunFinished"}}},
      "then": {"properties": {"data": {"$ref": "#/$defs/runFinishedData"}}}
    },
    {
      "if": {"properties": {"kind": {"const": "VerificationFinding"}}},
      "then": {"properties": {"data": {"$ref": "#/$defs/verificationFindingData"}}}
    },
    {
      "if": {"properties": {"kind": {"const": "ConfigApplied"}}},
      "then": {"properties": {"data": {"$ref": "#/$defs/configAppliedData"}}}
    }
  ]
}
